{
  "schema": "CheckpointV2",
  "schema_version": 2,
  "checkpoint_id": "ckpt_01",
  "logical_run_id": "run_logic_01",
  "task_id": "task_01",
  "attempt_id": "attempt_01",
  "step_id": "step_01",
  "parent_checkpoint_id": null,
  "principal_ref": "principal_01",
  "workspace_id": "ws_01",
  "session_id": "sess_01",
  "completed_steps": [],
  "pending_operation": null,
  "deadline": "2026-10-27T12:00:00Z",
  "committed_at": "2026-10-27T02:49:00Z"
}
